{
  "$schema": "https://json-schema.org/draft/2020-12/schema",
  "title": "Fannithm Map JSON v2-alpha.4 for Sekai Mode",
  "type": "object",
  "$defs": {
    "uuid": {
      "type": "string",
      "pattern": "^[0-9a-f]{8}-[0-9a-f]{4}-[0-9a-f]{4}-[0-9a-f]{4}-[0-9a-f]{12}$"
    },
    "beatInteger": {
      "type": "integer",
      "minimum": 0
    },
    "beatNumerator": {
      "type": "integer",
      "minimum": 0
    },
    "beatDenominator": {
      "type": "integer",
      "minimum": 1
    },
    "beat": {
      "type": "object",
      "properties": {
        "integer": {
          "$ref": "#/$defs/beatInteger"
        },
        "numerator": {
          "$ref": "#/$defs/beatNumerator"
        },
        "denominator": {
          "$ref": "#/$defs/beatDenominator"
        }
      },
      "required": ["integer"],
      "additionalProperties": false,
      "dependentRequired": {
        "numerator": ["denominator"],
        "denominator": ["numerator"]
      }
    },
    "integerLane": {
      "type": "integer",
      "minimum": 0,
      "maximum": 11
    },
    "integerWidth": {
      "type": "integer",
      "minimum": 1,
      "maximum": 12
    },
    "timeline": {
      "type": "object",
      "properties": {
        "id": {
          "$ref": "#/$defs/uuid"
        },
        "name": {
          "type": "string"
        },
        "speed": {
          "type": "number",
          "$comment": "default value: 1"
        }
      },
      "required": ["id", "name"],
      "additionalProperties": false
    },
    "bpm": {
      "type": "object",
      "properties": {
        "id": {
          "$ref": "#/$defs/uuid"
        },
        "timeline": {
          "$ref": "#/$defs/uuid"
        },
        "beat": {
          "$ref": "#/$defs/beat"
        },
        "bpm": {
          "type": "number",
          "exclusiveMinimum": 0
        }
      },
      "required": ["id", "timeline", "beat", "bpm"],
      "additionalProperties": false
    },
    "flickDirection": {
      "type": "string",
      "enum": ["up", "left", "right"]
    },
    "noteType": {
      "type": "string",
      "enum": ["tap", "flick", "trace", "flick-trace"]
    },
    "note": {
      "type": "object",
      "properties": {
        "id": {
          "$ref": "#/$defs/uuid"
        },
        "timeline": {
          "$ref": "#/$defs/uuid"
        },
        "beat": {
          "$ref": "#/$defs/beat"
        },
        "type": {
          "$ref": "#/$defs/noteType"
        },
        "lane": {
          "$ref": "#/$defs/integerLane"
        },
        "width": {
          "$ref": "#/$defs/integerWidth"
        },
        "critical": {
          "type": "boolean"
        },
        "direction": {
          "$ref": "#/$defs/flickDirection"
        }
      },
      "required": ["id", "timeline", "beat", "type", "lane", "width"],
      "additionalProperties": false,
      "if": {
        "type": "object",
        "properties": {
          "type": {
            "enum": ["flick", "flick-trace"]
          }
        }
      },
      "then": {
        "required": ["direction"]
      },
      "else": {
        "properties": {
          "direction": false
        }
      }
    },
    "slideNodeType": {
      "type": "string",
      "enum": ["start", "invisible", "visible", "end", "flick-end"]
    },
    "curveType": {
      "type": "string",
      "enum": [
        "none",
        "linear",
        "ease-in",
        "ease-out",
        "ease-in-out",
        "cubic-bezier"
      ]
    },
    "cubicBezierValue": {
      "type": "number",
      "minimum": 0,
      "maximum": 1
    },
    "cubicBezier": {
      "type": "object",
      "properties": {
        "x1": {
          "$ref": "#/$defs/cubicBezierValue"
        },
        "y1": {
          "$ref": "#/$defs/cubicBezierValue"
        },
        "x2": {
          "$ref": "#/$defs/cubicBezierValue"
        },
        "y2": {
          "$ref": "#/$defs/cubicBezierValue"
        }
      },
      "required": ["x1", "y1", "x2", "y2"],
      "additionalProperties": false
    },
    "slideNode": {
      "type": "object",
      "properties": {
        "id": {
          "$ref": "#/$defs/uuid"
        },
        "type": {
          "$ref": "#/$defs/slideNodeType"
        },
        "beat": {
          "$ref": "#/$defs/beat"
        },
        "lane": {
          "$ref": "#/$defs/integerLane"
        },
        "width": {
          "$ref": "#/$defs/integerWidth"
        },
        "curve": {
          "$ref": "#/$defs/curveType"
        },
        "bezier": {
          "$ref": "#/$defs/cubicBezier"
        },
        "critical": {
          "type": "boolean"
        },
        "direction": {
          "$ref": "#/$defs/flickDirection"
        }
      },
      "required": ["id", "type", "beat"],
      "additionalProperties": false,
      "allOf": [
        {
          "$comment": "make lane, width and curve optional for visible node",
          "if": {
            "type": "object",
            "properties": {
              "type": {
                "enum": ["visible"]
              }
            }
          },
          "then": {
            "$comment": "lane, width and curve is optional for visible note, but you must set all of them if needed",
            "dependentRequired": {
              "lane": ["width", "curve"],
              "width": ["lane", "curve"],
              "curve": ["lane", "width"]
            }
          },
          "else": {
            "required": ["lane", "width", "curve"]
          }
        },
        {
          "$comment": "add critical to end node",
          "if": {
            "type": "object",
            "properties": {
              "type": {
                "enum": ["end", "flick-end"]
              }
            }
          },
          "then": {
            "type": "object",
            "properties": {
              "curve": {
                "enum": ["none"]
              }
            }
          },
          "else": {
            "type": "object",
            "properties": {
              "critical": false
            }
          }
        },
        {
          "$comment": "add direction to flick-end node",
          "if": {
            "type": "object",
            "properties": {
              "type": {
                "enum": ["flick-end"]
              }
            }
          },
          "then": {
            "required": ["direction"]
          },
          "else": {
            "properties": {
              "direction": false
            }
          }
        },
        {
          "$comment": "make bezier required for bezier curve",
          "if": {
            "type": "object",
            "properties": {
              "curve": {
                "enum": ["cubic-bezier"]
              }
            },
            "required": ["curve"]
          },
          "then": {
            "type": "object",
            "required": ["bezier"]
          },
          "else": {
            "type": "object",
            "properties": {
              "bezier": false
            }
          }
        }
      ]
    },
    "slide": {
      "type": "object",
      "properties": {
        "id": {
          "$ref": "#/$defs/uuid"
        },
        "timeline": {
          "$ref": "#/$defs/uuid"
        },
        "critical": {
          "type": "boolean"
        },
        "nodes": {
          "type": "array",
          "items": {
            "$ref": "#/$defs/slideNode"
          },
          "minItems": 2
        }
      },
      "required": ["id", "timeline", "nodes"],
      "additionalProperties": false
    },
    "slideDecorationColor": {
      "type": "string",
      "enum": ["green", "yellow"]
    },
    "slideDecorationNode": {
      "type": "object",
      "properties": {
        "id": {
          "$ref": "#/$defs/uuid"
        },
        "beat": {
          "$ref": "#/$defs/beat"
        },
        "lane": {
          "type": "number",
          "minimum": 0,
          "maximum": 11
        },
        "width": {
          "type": "number",
          "minimum": 0,
          "maximum": 12
        },
        "curve": {
          "$ref": "#/$defs/curveType"
        },
        "bezier": {
          "$ref": "#/$defs/cubicBezier"
        }
      },
      "required": ["id", "beat", "lane", "width", "curve"],
      "additionalProperties": false,
      "if": {
        "type": "object",
        "properties": {
          "curve": {
            "enum": ["cubic-bezier"]
          }
        }
      },
      "then": {
        "required": ["bezier"]
      },
      "else": {
        "properties": {
          "bezier": false
        }
      }
    },
    "slideDecoration": {
      "type": "object",
      "properties": {
        "id": {
          "$ref": "#/$defs/uuid"
        },
        "timeline": {
          "$ref": "#/$defs/uuid"
        },
        "color": {
          "$ref": "#/$defs/slideDecorationColor"
        },
        "nodes": {
          "type": "array",
          "items": {
            "$ref": "#/$defs/slideDecorationNode"
          },
          "minItems": 2
        }
      },
      "required": ["id", "timeline", "color", "nodes"],
      "additionalProperties": false
    },
    "animation": {
      "type": "object",
      "properties": {
        "id": {
          "$ref": "#/$defs/uuid"
        },
        "target": {
          "$ref": "#/$defs/uuid"
        },
        "type": {
          "type": "string",
          "enum": ["speed"]
        },
        "beat": {
          "$ref": "#/$defs/beat"
        },
        "curve": {
          "$ref": "#/$defs/curveType"
        },
        "bezier": {
          "$ref": "#/$defs/cubicBezier"
        },
        "value": {
          "type": "number"
        }
      },
      "required": ["id", "target", "type", "beat", "curve", "value"],
      "additionalProperties": false,
      "if": {
        "type": "object",
        "properties": {
          "curve": {
            "enum": ["cubic-bezier"]
          }
        }
      },
      "then": {
        "required": ["bezier"]
      },
      "else": {
        "properties": {
          "bezier": false
        }
      }
    }
  },
  "properties": {
    "$schema": {
      "type": "string"
    },
    "$fannithm": {
      "type": "object",
      "properties": {
        "version": {
          "$comment": "The format version of the map file",
          "type": "string",
          "enum": ["v2"]
        },
        "mode": {
          "$comment": "The game mode of the map file",
          "type": "string",
          "enum": ["sekai"]
        },
        "offset": {
          "$comment": "The time offset of the map file (in second)",
          "type": "number"
        }
      },
      "required": ["version", "mode"],
      "additionalProperties": false
    },
    "timelines": {
      "type": "array",
      "items": {
        "$ref": "#/$defs/timeline"
      },
      "minItems": 1
    },
    "bpms": {
      "type": "array",
      "items": {
        "$ref": "#/$defs/bpm"
      },
      "minItems": 1
    },
    "notes": {
      "type": "array",
      "items": {
        "$ref": "#/$defs/note"
      }
    },
    "slides": {
      "type": "array",
      "items": {
        "$ref": "#/$defs/slide"
      }
    },
    "decorations": {
      "type": "object",
      "properties": {
        "slides": {
          "type": "array",
          "items": {
            "$ref": "#/$defs/slideDecoration"
          }
        }
      }
    },
    "animations": {
      "type": "array",
      "items": {
        "$ref": "#/$defs/animation"
      }
    }
  },
  "required": ["$fannithm", "timelines", "bpms"],
  "additionalProperties": false
}
