{
  "$schema": "./map-schema-v2-sekai.json",
  "$fannithm": {
    "version": "v2",
    "mode": "sekai",
    "offset": 0
  },
  "timelines": [
    {
      "id": "dd3db744-e5a8-4dfb-be0b-d1676dfc51ee",
      "name": "Timeline 1",
      "speed": 1
    }
  ],
  "bpms": [
    {
      "id": "2b2fff30-de32-4f75-8446-fdcfb26199fd",
      "timeline": "dd3db744-e5a8-4dfb-be0b-d1676dfc51ee",
      "beat": {
        "integer": 0
      },
      "bpm": 120
    }
  ],
  "notes": [
    {
      "id": "6b3d281a-fd4a-4045-8780-faf460b48abb",
      "timeline": "dd3db744-e5a8-4dfb-be0b-d1676dfc51ee",
      "type": "tap",
      "beat": {
        "integer": 1,
        "numerator": 1,
        "denominator": 2
      },
      "lane": 0,
      "width": 3
    },
    {
      "id": "a59415a4-db3e-4ea7-baf6-2fa67e5979dd",
      "timeline": "dd3db744-e5a8-4dfb-be0b-d1676dfc51ee",
      "type": "trace",
      "beat": {
        "integer": 1,
        "numerator": 1,
        "denominator": 2
      },
      "lane": 9,
      "width": 3
    },
    {
      "id": "ce7f116f-b982-41d8-b2ab-25664420bae5",
      "timeline": "dd3db744-e5a8-4dfb-be0b-d1676dfc51ee",
      "type": "flick-trace",
      "beat": {
        "integer": 2
      },
      "lane": 0,
      "width": 12,
      "direction": "up",
      "critical": true
    }
  ],
  "slides": [
    {
      "id": "30f079d7-1413-4a6f-aa38-69d2e2a6700e",
      "timeline": "dd3db744-e5a8-4dfb-be0b-d1676dfc51ee",
      "critical": true,
      "nodes": [
        {
          "id": "4853a8c1-94f3-42f5-a60c-eaddd20701d2",
          "type": "start",
          "beat": {
            "integer": 3
          },
          "lane": 0,
          "width": 3,
          "curve": "cubic-bezier",
          "bezier": {
            "x1": 0,
            "y1": 0,
            "x2": 1,
            "y2": 1
          }
        },
        {
          "id": "8d78494d-f947-4779-b939-8a0a4be198a0",
          "type": "visible",
          "beat": {
            "integer": 4
          }
        },
        {
          "id": "8d78494d-f947-4779-b939-8a0a4be198a0",
          "type": "invisible",
          "beat": {
            "integer": 4
          },
          "lane": 0,
          "width": 6,
          "curve": "ease-out"
        },
        {
          "id": "4e3670f0-890a-4b6c-8f9d-8b6b8f320d48",
          "type": "flick-end",
          "beat": {
            "integer": 5
          },
          "lane": 0,
          "width": 3,
          "curve": "none",
          "direction": "up"
        }
      ]
    }
  ],
  "animations": [
    {
      "id": "56bb55b9-1eb4-48cd-85f4-6588f560bb24",
      "target": "dd3db744-e5a8-4dfb-be0b-d1676dfc51ee",
      "type": "speed",
      "beat": {
        "integer": 0
      },
      "curve": "linear",
      "value": 1
    },
    {
      "id": "5136a618-2634-4ff2-9171-1d15735b1786",
      "target": "dd3db744-e5a8-4dfb-be0b-d1676dfc51ee",
      "type": "speed",
      "beat": {
        "integer": 1
      },
      "value": 1,
      "curve": "none"
    }
  ],
  "decorations": {
    "slides": [
      {
        "id": "e6526578-7222-40ec-a902-d8c8cce5edc3",
        "timeline": "dd3db744-e5a8-4dfb-be0b-d1676dfc51ee",
        "color": "green",
        "nodes": [
          {
            "id": "f90517e4-8dcc-4158-b55b-787b7bd1180f",
            "beat": {
              "integer": 6
            },
            "lane": 0,
            "width": 12,
            "curve": "ease-in"
          },
          {
            "id": "c13bf443-1faa-474b-86ef-6236d9891632",
            "beat": {
              "integer": 8
            },
            "lane": 0,
            "width": 2,
            "curve": "none"
          }
        ]
      },
      {
        "id": "063e2399-f3c3-40b0-88ec-c60dda0701fb",
        "timeline": "dd3db744-e5a8-4dfb-be0b-d1676dfc51ee",
        "color": "yellow",
        "nodes": [
          {
            "id": "f90517e4-8dcc-4158-b55b-787b7bd1180f",
            "beat": {
              "integer": 6
            },
            "lane": 0,
            "width": 12,
            "curve": "ease-in"
          },
          {
            "id": "c13bf443-1faa-474b-86ef-6236d9891632",
            "beat": {
              "integer": 8
            },
            "lane": 10,
            "width": 2,
            "curve": "none"
          }
        ]
      }
    ]
  }
}
